Question,Answer
What is AI?,Artificial Intelligence enables machines to simulate human intelligence.
What is Machine Learning?,Machine Learning allows systems to learn from data without explicit programming.
What is Deep Learning?,Deep Learning is a subset of Machine Learning that uses neural networks.
What is NLP?,Natural Language Processing helps computers understand human language.
What is Computer Vision?,Computer Vision allows computers to interpret images and videos.
What is Generative AI?,Generative AI creates new content such as text images audio and videos.
What is Python?,Python is a high level programming language used for many applications.
Who developed Python?,Python was developed by Guido van Rossum.
What is Data Science?,Data Science is the process of extracting insights from data.
What is a Neural Network?,A Neural Network is a system inspired by the human brain for pattern recognition.
What is supervised learning?,Supervised learning trains models using labeled data.
What is unsupervised learning?,Unsupervised learning identifies patterns in unlabeled data.
What is reinforcement learning?,Reinforcement learning trains agents using rewards and penalties.
What is TensorFlow?,TensorFlow is an open-source Machine Learning framework developed by Google.
What is PyTorch?,PyTorch is a deep learning framework used for AI applications.
What is a dataset?,A dataset is a collection of related data used for analysis and training.
What is a chatbot?,A chatbot is a software application that simulates conversation with users.
What is cloud computing?,Cloud computing provides computing services through the internet.
What is Big Data?,Big Data refers to very large datasets that require advanced processing.
What is OpenCV?,OpenCV is a library used for computer vision and image processing.
What is a programming language?,A programming language is used to communicate instructions to computers.
What is an API?,API stands for Application Programming Interface and allows communication between software systems.
What is Streamlit?,Streamlit is a Python framework used for creating web applications quickly.
What is GitHub?,GitHub is a platform used for version control and code collaboration.
What is cybersecurity?,Cybersecurity protects systems and networks from attacks.
What is a database?,A database is an organized collection of data.
What is SQL?,SQL is a language used to manage databases.
What is automation?,Automation uses technology to perform tasks with minimal human intervention.
What is an algorithm?,An algorithm is a step-by-step procedure for solving a problem.
What is data mining?,Data mining is the process of discovering useful patterns in data.
What is a search engine?,A search engine finds information on the internet.
What is the Internet of Things?,Internet of Things connects devices through the internet.
What is a web application?,A web application is software that runs in a browser.
What is object detection?,Object detection identifies and locates objects in images or videos.
What is image processing?,Image processing involves manipulating images to improve quality or extract information.
What is robotics?,Robotics is the field of designing and building robots.
What is blockchain?,Blockchain is a decentralized digital ledger technology.
What is virtual reality?,Virtual Reality creates a simulated digital environment.
What is augmented reality?,Augmented Reality overlays digital elements on the real world.
What is software development?,Software development is the process of designing and building applications.